{
  "scope": {
    "copyrighted_work": true,
    "copyright_use_occurs": true
  },
  "conditions": {
    "information_analysis": true,
    "other_non_enjoyment_purpose": false,
    "enjoyment_of_target_work": false,
    "coexisting_enjoyment_purpose": false,
    "intentional_reproduction_output_purpose": false,
    "within_necessary_extent": true,
    "unreasonably_prejudices_rightsholder": false
  },
  "evidence": {
    "ai_training_market_dataset": true,
    "refs": [
      "evidence://market-assessment/001"
    ]
  },
  "context": {
    "note": "Marketed-for-training status is a warning relevant to the prejudice analysis, not an independent statutory FAIL."
  }
}
